Pergunta,Resposta
"Quais são os horários de atendimento?", "Nosso horário de atendimento é de segunda a sexta, das 9h às 18h."
"Como posso alterar minha senha?", "Você pode alterar sua senha acessando a página de configurações da sua conta."
"formas de pagamento", "Aceitamos pagamentos via cartão de crédito, boleto bancário e Pix."
"Quais são as formas de pagamento aceitas?", "Aceitamos pagamentos via cartão de crédito, boleto bancário e Pix."
"Posso cancelar meu pedido?", "Sim, você pode cancelar seu pedido antes do envio. Após o envio, consulte a política de devolução."
"Como faço para acompanhar meu pedido?", "Você pode acompanhar o status do seu pedido na página 'Meus Pedidos', dentro da sua conta."
"Qual o prazo de entrega?", "O prazo de entrega varia de acordo com a sua localização e será informado na finalização do pedido."

